{
  "schema_version": 1,
  "checkpoint_id": "CP-000004-9a2d60d0",
  "authority": "EVIDENCE_ONLY",
  "runtime_control_authority": "NONE",
  "created_at": "2026-09-14T09:13:27Z",
  "source_main_sha": "47cb69f9032a5ca02ebabe5934bc0d672090d0f1",
  "work_id": "3edfca10-ac11-4a79-bd31-72bd84165594",
  "work_branch": "work/3edfca10-ac11-4a79-bd31-72bd84165594",
  "work_head_sha": "9a2d60d07b8d7279ad822cccec2b255af45d6608",
  "trigger_ids": [
    "MUTATION_RESULT_TERMINAL",
    "CANONICAL_LIVE_MISMATCH_SET_CHANGED",
    "OPEN_BLOCKER_SET_CHANGED",
    "LIVE_MAIN_SHA_CHANGED",
    "TRACKED_PR_STATE_CHANGED",
    "MERGE_GROUP_TERMINAL",
    "POST_MERGE_VALIDATE_TERMINAL",
    "NON_CHECKPOINT_TOOL_RESULT_COUNT_GTE_LIMIT"
  ],
  "previous_checkpoint": {
    "path": "continuity/checkpoints/CP-000003-6f4c2a91.json",
    "blob_sha": "273596ba6ed8302529437c1a2aff656028d1462d"
  },
  "selected_work": {
    "worker_lane": "NOT_EVALUATED",
    "selected_rank": null,
    "selected_work_id": null,
    "evaluated_at": "2026-09-14T09:13:27Z",
    "evidence_ref": "THREAD_LIFECYCLE:CONTINUE_ACTIVE_GOAL;ROOT_NONTERMINAL:A-0014_TERMINAL_REDISPATCH_AND_ISSUE_LIFECYCLE_CLOSURE;POST_MERGE_VALIDATE_REPAIR_ACTIVE",
    "authority": "HISTORICAL_OBSERVATION_ONLY"
  },
  "canonical_snapshot": {
    "current_component": "goal_lifecycle_identity",
    "current_status": "ACTIVE",
    "current_next_action_id": "A-0014",
    "canonical_live_mismatch_ids": [
      "CURRENT_JSON_GITHUB_HEAD_STALE",
      "PR_89_POST_MERGE_VALIDATE_FAILED_REPAIR_PR_91_PENDING_INTEGRATION"
    ],
    "open_blocker_ids": [
      "B-0004",
      "POST_MERGE_VALIDATE_FAILED_34824619731"
    ],
    "observed_at": "2026-09-14T09:13:27Z"
  },
  "goal_snapshot": {
    "active_root_goal_id": "2910e7b9-87d8-4a82-b0ff-330b47037bf6",
    "active_goal_id": "2910e7b9-87d8-4a82-b0ff-330b47037bf6",
    "active_path": [
      "2910e7b9-87d8-4a82-b0ff-330b47037bf6"
    ],
    "observed_at": "2026-09-14T09:13:27Z",
    "authority": "HISTORICAL_OBSERVATION_ONLY"
  },
  "claim_observations": [
    {
      "resource_key": "component:auto_issue_dispatch",
      "lock_branch": "lock/75469188961c5dfe89c760bf3e46f0b521f3e2d55d62d553eec19de5bb4a0f3a",
      "state": "ACTIVE",
      "work_id": "3edfca10-ac11-4a79-bd31-72bd84165594",
      "lease_id": "bf5c121f-5265-4d9a-8790-2870b658b787",
      "generation": 4,
      "expires_at": "2026-09-14T09:40:06Z",
      "observed_at": "2026-09-14T09:13:27Z",
      "live_verify_required": true
    },
    {
      "resource_key": "component:goal_lifecycle_identity",
      "lock_branch": "lock/44e6462593dcdcc36d21932cb333fbd25b2af0bffa3c81d2eadf5072ee4f30c9",
      "state": "ACTIVE",
      "work_id": "3edfca10-ac11-4a79-bd31-72bd84165594",
      "lease_id": "70eccc39-af95-4bd6-8edd-adef1e67a2de",
      "generation": 4,
      "expires_at": "2026-09-14T09:40:06Z",
      "observed_at": "2026-09-14T09:13:27Z",
      "live_verify_required": true
    },
    {
      "resource_key": "component:multi_thread_coordination_hardening",
      "lock_branch": "lock/59cb0115181bd2c23a385594018248f94c140e7c29c394c3def5d23c0dfa90d8",
      "state": "ACTIVE",
      "work_id": "3edfca10-ac11-4a79-bd31-72bd84165594",
      "lease_id": "022cc061-7a8e-40eb-819e-2df512861050",
      "generation": 6,
      "expires_at": "2026-09-14T09:40:06Z",
      "observed_at": "2026-09-14T09:13:27Z",
      "live_verify_required": true
    },
    {
      "resource_key": "component:watchdog",
      "lock_branch": "lock/26555f0ea7b1ec2ba6331615932a7abdf07f13a82a2418eb25b5194e83e4ca83",
      "state": "ACTIVE",
      "work_id": "3edfca10-ac11-4a79-bd31-72bd84165594",
      "lease_id": "f240fd4c-ae50-48ed-aa66-66b33f194040",
      "generation": 3,
      "expires_at": "2026-09-14T09:40:06Z",
      "observed_at": "2026-09-14T09:13:27Z",
      "live_verify_required": true
    }
  ],
  "operation_results": [
    {
      "system": "GITHUB",
      "target": "KINETIC-DESIGN-CO/Build:main",
      "operation": "VERIFY_PR_89_MERGE_GROUP_AND_POST_MERGE_VALIDATE",
      "result": "FAILURE",
      "readback_state": "VERIFIED",
      "evidence_refs": [
        "GITHUB_PR:89:MERGED",
        "GITHUB_MERGE_GROUP_RUN:34824433189:SUCCESS",
        "GITHUB_POST_MERGE_RUN:34824619731:FAILURE"
      ]
    },
    {
      "system": "GITHUB",
      "target": "tests/test_work_selection.py",
      "operation": "REPAIR_LEGACY_V1_ACTIVE_LOCK_FIXTURE_FOR_V4_EFFECTIVE_EXPIRY",
      "result": "SUCCESS",
      "readback_state": "VERIFIED",
      "evidence_refs": [
        "COMMIT:de4fa5e43376b2a5a0d6b3ecc0fc1a38e119e926",
        "READBACK:heartbeat_at:2026-09-12T13:45:00Z"
      ]
    },
    {
      "system": "GITHUB",
      "target": "tests/test_thread_lifecycle.py",
      "operation": "REPAIR_SYNTHETIC_CHILD_GOAL_REVISION_TRANSITION_FIXTURE",
      "result": "SUCCESS",
      "readback_state": "VERIFIED",
      "evidence_refs": [
        "COMMIT:e395356a226e00b4ca39299802b622a77371cb60",
        "READBACK:ROOT_REVISION_SIGNAL_AND_ACTIVE_ATTEMPT_ALIGNED"
      ]
    },
    {
      "system": "GITHUB",
      "target": "GITHUB_PR:91",
      "operation": "RUN_EXACT_HEAD_VALIDATE",
      "result": "SUCCESS",
      "readback_state": "VERIFIED",
      "evidence_refs": [
        "HEAD:9a2d60d07b8d7279ad822cccec2b255af45d6608",
        "GITHUB_ACTION_RUN:34826425436:SUCCESS"
      ]
    }
  ],
  "directive_refs": [
    "VD-0023",
    "VD-0024",
    "VD-0029"
  ],
  "decision_rationale_refs": [
    "DR-0010"
  ],
  "research_refs": [],
  "live_verify": [
    {
      "evidence_class": "LIVE_GITHUB",
      "target": "KINETIC-DESIGN-CO/Build:main",
      "required": true
    },
    {
      "evidence_class": "LIVE_GITHUB",
      "target": "work/3edfca10-ac11-4a79-bd31-72bd84165594",
      "required": true
    },
    {
      "evidence_class": "LIVE_GITHUB",
      "target": "GITHUB_PR:91",
      "required": true
    },
    {
      "evidence_class": "LIVE_GITHUB",
      "target": "component:auto_issue_dispatch",
      "required": true
    },
    {
      "evidence_class": "LIVE_GITHUB",
      "target": "component:goal_lifecycle_identity",
      "required": true
    },
    {
      "evidence_class": "LIVE_GITHUB",
      "target": "component:multi_thread_coordination_hardening",
      "required": true
    },
    {
      "evidence_class": "LIVE_GITHUB",
      "target": "component:watchdog",
      "required": true
    },
    {
      "evidence_class": "LIVE_SUPABASE",
      "target": "jnenguxodtgwbskhdsxt",
      "required": true
    }
  ],
  "resume_candidate": {
    "operation_state": "NONE",
    "candidate_next_operation": "RUN_EXACT_HEAD_VALIDATE_AFTER_CP_000004_AND_WORK_RECORD_COVERAGE;IF_SUCCESS_ENQUEUE_PR_91_REPAIR_POST_MERGE_V4_WORK_SELECTION_FIXTURES_IN_REQUIRED_GITHUB_MERGE_QUEUE;VERIFY_MERGE_GROUP_VALIDATE_AND_POST_MERGE_MAIN_VALIDATE_BEFORE_ROOT_COMPLETION",
    "authority": "NONE"
  },
  "context_refs": [
    "GITHUB_ISSUE:49",
    "GITHUB_PR:89",
    "GITHUB_PR:91",
    "GOAL:2910e7b9-87d8-4a82-b0ff-330b47037bf6",
    "WORK:3edfca10-ac11-4a79-bd31-72bd84165594",
    "continuity/current.json:A-0014",
    "governance/goal-registry.json",
    "governance/work-fence-policy.json",
    "coordination/protocol.json"
  ]
}
