{
  "schema_version": 1,
  "checkpoint_id": "CP-000008-41b7c2e9",
  "authority": "EVIDENCE_ONLY",
  "runtime_control_authority": "NONE",
  "created_at": "2026-09-14T09:29:12Z",
  "source_main_sha": "47cb69f9032a5ca02ebabe5934bc0d672090d0f1",
  "work_id": "4264779b-70c5-4381-b619-f2c3204dc4f3",
  "work_branch": "work/4264779b-70c5-4381-b619-f2c3204dc4f3",
  "work_head_sha": "5e420c445ce3ff0e26d516a45fc59ceb2a1a3faa",
  "trigger_ids": [
    "MUTATION_RESULT_TERMINAL",
    "NON_CHECKPOINT_TOOL_RESULT_COUNT_GTE_LIMIT"
  ],
  "previous_checkpoint": {
    "path": "continuity/checkpoints/CP-000007-75d17604.json",
    "blob_sha": "9ac8cda15e1ba0a415d87d736b5fcf9b24f6e7bb"
  },
  "selected_work": {
    "worker_lane": "PARALLEL_ASSIGNED",
    "selected_rank": 3,
    "selected_work_id": "github-issue-57",
    "evaluated_at": "2026-09-14T09:29:12Z",
    "evidence_ref": "governance/work-admissions.json:github-issue-57=ADMITTED with github-issue-15=COMPLETE; live component:issue_57 generation 4 ACTIVE under work_id 4264779b-70c5-4381-b619-f2c3204dc4f3 through 2026-09-14T09:35:15Z; root goal remains separately active under goal_lifecycle_identity and PR #91 is on its separate work branch.",
    "authority": "HISTORICAL_OBSERVATION_ONLY"
  },
  "canonical_snapshot": {
    "current_component": "goal_lifecycle_identity",
    "current_status": "ACTIVE",
    "current_next_action_id": "A-0014",
    "canonical_live_mismatch_ids": [
      "CURRENT_JSON_LAST_OBSERVED_GITHUB_HEAD_STALE_VS_LIVE_MAIN_47CB69F",
      "CURRENT_JSON_ROOT_COMPLETION_SNAPSHOT_STALE_AFTER_PR_89"
    ],
    "open_blocker_ids": [
      "B-0004"
    ],
    "observed_at": "2026-09-14T09:29:12Z"
  },
  "goal_snapshot": {
    "active_root_goal_id": "2910e7b9-87d8-4a82-b0ff-330b47037bf6",
    "active_goal_id": "2910e7b9-87d8-4a82-b0ff-330b47037bf6",
    "active_path": [
      "2910e7b9-87d8-4a82-b0ff-330b47037bf6"
    ],
    "observed_at": "2026-09-14T09:29:12Z",
    "authority": "HISTORICAL_OBSERVATION_ONLY"
  },
  "claim_observations": [
    {
      "resource_key": "component:issue_57",
      "lock_branch": "lock/39f64bd9d0ea39ae54c0417742d6c38cf0eccf0fdb7b2a4b7867a7662ae48c33",
      "state": "ACTIVE",
      "work_id": "4264779b-70c5-4381-b619-f2c3204dc4f3",
      "lease_id": "decde849-aebc-4557-8b3b-daa811a6c580",
      "generation": 4,
      "expires_at": "2026-09-14T09:35:15Z",
      "observed_at": "2026-09-14T09:29:12Z",
      "live_verify_required": true
    }
  ],
  "operation_results": [
    {
      "system": "GITHUB",
      "target": "work/4264779b-70c5-4381-b619-f2c3204dc4f3@5e420c445ce3ff0e26d516a45fc59ceb2a1a3faa",
      "operation": "OBSERVE_PREDICATE_REGISTRY_AND_CONTROL_CONTRACT_BINDING_COMMITS",
      "result": "SUCCESS",
      "readback_state": "VERIFIED",
      "evidence_refs": [
        "github:branch_head=5e420c445ce3ff0e26d516a45fc59ceb2a1a3faa",
        "github:compare:behind_by=0",
        "github:file=contracts/semantic-firewall-v1/predicate-registry.json",
        "github:file=contracts/semantic-firewall-v1/predicate-registry.schema.json",
        "github:file=contracts/semantic-firewall-v1/control-contract.schema.json"
      ]
    },
    {
      "system": "GITHUB",
      "target": "coordination/work/4264779b-70c5-4381-b619-f2c3204dc4f3.json",
      "operation": "VERIFY_WORK_RECORD_PATH_COVERAGE_AFTER_PREDICATE_COMMITS",
      "result": "FAILURE",
      "readback_state": "VERIFIED",
      "evidence_refs": [
        "predicate-registry.json=changed_not_listed",
        "predicate-registry.schema.json=changed_not_listed",
        "CP-000007-75d17604.json=changed_not_listed",
        "work_record_repo_paths_reconciliation_required"
      ]
    },
    {
      "system": "SUPABASE",
      "target": "jnenguxodtgwbskhdsxt",
      "operation": "READ_CANONICAL_INVOCATION_RUNTIME_SURFACE",
      "result": "SUCCESS",
      "readback_state": "VERIFIED",
      "evidence_refs": [
        "project_status=ACTIVE_HEALTHY",
        "organization_plan=free",
        "edge_function_count=0",
        "database_function_life.invoke=absent",
        "database_function_life.record_invocation_v1=present",
        "canonical_invocation=NOT_RUN"
      ]
    },
    {
      "system": "VERCEL",
      "target": "NO_AUTHORIZED_LIFE_TARGET",
      "operation": "READ_CONNECTED_TEAM_AND_PROJECT_SURFACE",
      "result": "SUCCESS",
      "readback_state": "VERIFIED",
      "evidence_refs": [
        "connected_team_plan=hobby",
        "connected_project_count=0",
        "canonical_invocation=NOT_RUN"
      ]
    }
  ],
  "directive_refs": [
    "VD-0001",
    "VD-0002",
    "VD-0011"
  ],
  "decision_rationale_refs": [
    "DR-0001",
    "DR-0002"
  ],
  "research_refs": [
    {
      "source_kind": "ACADEMIC",
      "title": "Stored Is Not Supported: Typed Provenance and Assertion Guardrails for Persistent AI Agents",
      "url": "https://arxiv.org/abs/2609.02127",
      "observed_date": "2026-09-14",
      "supported_claim": "Typed persistence does not upgrade evidentiary standing; predicate inputs require explicit accepted-evidence and provenance rules instead of type-based trust laundering."
    },
    {
      "source_kind": "ACADEMIC",
      "title": "Safety Testing LLM Agents at Scale: From Risk Discovery to Evidence-Grounded Verification",
      "url": "https://arxiv.org/abs/2607.01793",
      "observed_date": "2026-09-14",
      "supported_claim": "Programmatically constructed state plus deterministic verification predicates grounded in observable artifacts supports exact falsification rather than model self-report."
    },
    {
      "source_kind": "ACADEMIC",
      "title": "From Agent Traces to Trust: Evidence Tracing and Execution Provenance in LLM Agents",
      "url": "https://arxiv.org/abs/2606.04990",
      "observed_date": "2026-09-14",
      "supported_claim": "Execution provenance and evidence lineage support auditable binding from evidence through protected tool decisions."
    },
    {
      "source_kind": "OFFICIAL",
      "title": "Policy Language | Open Policy Agent",
      "url": "https://www.openpolicyagent.org/docs/policy-language",
      "observed_date": "2026-09-14",
      "supported_claim": "A mature external policy engine represents decisions as explicit declarative assertions over structured input; this supports Life's closed predicate registry direction but does not justify adding OPA as a new runtime dependency now."
    },
    {
      "source_kind": "REDDIT",
      "title": "What guardrails are you using around agent tool calls?",
      "url": "https://www.reddit.com/r/aiagents/comments/1u7lgfo/what_guardrails_are_you_using_around_agent_tool/",
      "observed_date": "2026-09-14",
      "supported_claim": "Practitioner discussion independently reports that tool schemas alone miss stateful authorization, idempotency, approval scope, and replay state; deterministic external gates are a common workaround."
    },
    {
      "source_kind": "OFFICIAL",
      "title": "Introducing the Agents API",
      "url": "https://openai.com/index/introducing-the-agents-api/",
      "observed_date": "2026-09-14",
      "supported_claim": "The current OpenAI managed agent harness adds long sessions, tools, and subagents but remains an execution harness rather than a replacement for Life's deterministic authorization predicates."
    }
  ],
  "live_verify": [
    {
      "evidence_class": "LIVE_GITHUB",
      "target": "repository:1366835183/main=47cb69f9032a5ca02ebabe5934bc0d672090d0f1",
      "required": true
    },
    {
      "evidence_class": "LIVE_GITHUB",
      "target": "work/4264779b-70c5-4381-b619-f2c3204dc4f3@5e420c445ce3ff0e26d516a45fc59ceb2a1a3faa",
      "required": true
    },
    {
      "evidence_class": "LIVE_GITHUB",
      "target": "lock/39f64bd9d0ea39ae54c0417742d6c38cf0eccf0fdb7b2a4b7867a7662ae48c33",
      "required": true
    },
    {
      "evidence_class": "LIVE_SUPABASE",
      "target": "jnenguxodtgwbskhdsxt",
      "required": true
    },
    {
      "evidence_class": "LIVE_VERCEL",
      "target": "NO_AUTHORIZED_TARGET_CONNECTED_PROJECT_COUNT_0",
      "required": true
    }
  ],
  "resume_candidate": {
    "operation_state": "PENDING",
    "candidate_next_operation": "RECONCILE THE ISSUE #57 WORK RECORD TO THE EXACT CURRENT BRANCH PATH SET, THEN FINISH PREDICATE-LEVEL DETERMINISM BY WIRING THE CANONICAL PREDICATE REGISTRY INTO EVALUATION AND CONFORMANCE, FAILING UNDEFINED CONTROL PREDICATES AS PREDICATE_DEFINITION_MISSING, REJECTING UNSAFE PROVENANCE LAUNDERING, ADDING POSITIVE AND ADVERSARIAL FALSIFICATION, UPDATING BOOTSTRAP/SPEC/DOCUMENTATION, AND RUNNING REQUIRED VALIDATION BEFORE PR CREATION.",
    "authority": "NONE"
  },
  "context_refs": [
    "continuity/checkpoints/CP-000007-75d17604.json",
    "GITHUB_ISSUE:57:Migrate legacy Semantic Firewall and make the work deterministically dispatchable",
    "GITHUB_ISSUE:87:Finish residual Architecture-project salvage into Life without rebuilding the legacy control plane",
    "GITHUB_PR:91:Repair post-merge v4 work-selection fixtures",
    "GITHUB_MAIN:47cb69f9032a5ca02ebabe5934bc0d672090d0f1",
    "GITHUB_WORK_BRANCH:5e420c445ce3ff0e26d516a45fc59ceb2a1a3faa",
    "governance/goal-registry.json:2910e7b9-87d8-4a82-b0ff-330b47037bf6",
    "continuity/current.json:A-0014:Terminal Redispatch & Issue Lifecycle Closure",
    "contracts/semantic-firewall-v1/predicate-registry.json",
    "contracts/semantic-firewall-v1/predicate-registry.schema.json",
    "contracts/semantic-firewall-v1/control-contract.schema.json"
  ]
}
