{
  "schema_version": 1,
  "checkpoint_id": "CP-000009-2fd4f512",
  "authority": "EVIDENCE_ONLY",
  "runtime_control_authority": "NONE",
  "created_at": "2026-09-14T10:08:05Z",
  "source_main_sha": "d5dd4c18917447c37590b125ce4c6d77f01e5e91",
  "work_id": "4264779b-70c5-4381-b619-f2c3204dc4f3",
  "work_branch": "work/4264779b-70c5-4381-b619-f2c3204dc4f3",
  "work_head_sha": "2fd4f5127d2c70625a7c6a624594b2cf00224531",
  "trigger_ids": [
    "MUTATION_RESULT_TERMINAL",
    "CANONICAL_LIVE_MISMATCH_SET_CHANGED",
    "OPEN_BLOCKER_SET_CHANGED",
    "LIVE_MAIN_SHA_CHANGED",
    "TRACKED_PR_STATE_CHANGED",
    "MERGE_GROUP_TERMINAL",
    "POST_MERGE_VALIDATE_TERMINAL",
    "NON_CHECKPOINT_TOOL_RESULT_COUNT_GTE_LIMIT"
  ],
  "previous_checkpoint": {
    "path": "continuity/checkpoints/CP-000008-41b7c2e9.json",
    "blob_sha": "7e73de8ddb2413e46a009e4c26787cea61ca4e45"
  },
  "selected_work": {
    "worker_lane": "PARALLEL_ASSIGNED",
    "selected_rank": 3,
    "selected_work_id": "github-issue-57",
    "evaluated_at": "2026-09-14T10:08:05Z",
    "evidence_ref": "governance/work-admissions.json:github-issue-57=ADMITTED; live component:issue_57 generation 4 ACTIVE under work_id 4264779b-70c5-4381-b619-f2c3204dc4f3; root goal remains separately active",
    "authority": "HISTORICAL_OBSERVATION_ONLY"
  },
  "canonical_snapshot": {
    "current_component": "goal_lifecycle_identity",
    "current_status": "ACTIVE",
    "current_next_action_id": "A-0014",
    "canonical_live_mismatch_ids": [
      "CURRENT_JSON_LAST_OBSERVED_GITHUB_HEAD_STALE_VS_LIVE_MAIN_D5DD4C1"
    ],
    "open_blocker_ids": [
      "B-0004"
    ],
    "observed_at": "2026-09-14T10:08:05Z"
  },
  "goal_snapshot": {
    "active_root_goal_id": "2910e7b9-87d8-4a82-b0ff-330b47037bf6",
    "active_goal_id": "2910e7b9-87d8-4a82-b0ff-330b47037bf6",
    "active_path": [
      "2910e7b9-87d8-4a82-b0ff-330b47037bf6"
    ],
    "observed_at": "2026-09-14T10:08:05Z",
    "authority": "HISTORICAL_OBSERVATION_ONLY"
  },
  "claim_observations": [
    {
      "resource_key": "component:issue_57",
      "lock_branch": "lock/39f64bd9d0ea39ae54c0417742d6c38cf0eccf0fdb7b2a4b7867a7662ae48c33",
      "state": "ACTIVE",
      "work_id": "4264779b-70c5-4381-b619-f2c3204dc4f3",
      "lease_id": "decde849-aebc-4557-8b3b-daa811a6c580",
      "generation": 4,
      "expires_at": "2026-09-14T10:35:48Z",
      "observed_at": "2026-09-14T10:08:05Z",
      "live_verify_required": true
    }
  ],
  "operation_results": [
    {
      "system": "GITHUB",
      "target": "GITHUB_PR:91:Repair post-merge v4 work-selection fixtures",
      "operation": "VERIFY_PROTECTED_INTEGRATION_AND_POST_MERGE_VALIDATE",
      "result": "SUCCESS",
      "readback_state": "VERIFIED",
      "evidence_refs": [
        "GITHUB_MERGE_GROUP_RUN:34830630988:SUCCESS",
        "GITHUB_MAIN:d5dd4c18917447c37590b125ce4c6d77f01e5e91",
        "GITHUB_POST_MERGE_RUN:34830856566:SUCCESS"
      ]
    },
    {
      "system": "GITHUB",
      "target": "work/4264779b-70c5-4381-b619-f2c3204dc4f3@2fd4f5127d2c70625a7c6a624594b2cf00224531",
      "operation": "RECONCILE_WITH_CURRENT_MAIN_AND_VERIFY_DIFF",
      "result": "SUCCESS",
      "readback_state": "VERIFIED",
      "evidence_refs": [
        "PARENT:e27d86bb7a938e92c8ccfd9839a258ea54204c9e",
        "PARENT:d5dd4c18917447c37590b125ce4c6d77f01e5e91",
        "COMPARE:behind_by=0",
        "COMPARE:exact_18_semantic_firewall_paths"
      ]
    },
    {
      "system": "GITHUB",
      "target": "GITHUB_PR:92:Close predicate-level ambiguity in Semantic Firewall@2fd4f5127d2c70625a7c6a624594b2cf00224531",
      "operation": "RUN_RECONCILED_EXACT_HEAD_VALIDATE",
      "result": "SUCCESS",
      "readback_state": "VERIFIED",
      "evidence_refs": [
        "GITHUB_ACTION_RUN:34831380363:SUCCESS",
        "SEMANTIC_FIREWALL_VALIDATION:SUCCESS",
        "RELIABILITY_VALIDATION:SUCCESS",
        "WORK_FENCE_VALIDATION:SUCCESS",
        "COORDINATION_VALIDATION:SUCCESS",
        "REPOSITORY_TESTS:SUCCESS",
        "SUPABASE_DATABASE_TESTS:SUCCESS"
      ]
    },
    {
      "system": "SUPABASE",
      "target": "jnenguxodtgwbskhdsxt",
      "operation": "READ_CANONICAL_INVOCATION_RUNTIME_SURFACE",
      "result": "SUCCESS",
      "readback_state": "VERIFIED",
      "evidence_refs": [
        "project_status=ACTIVE_HEALTHY",
        "organization_plan=free",
        "edge_function_count=0",
        "database_function_life.invoke=absent",
        "database_function_life.record_invocation_v1=present",
        "canonical_invocation=NOT_RUN"
      ]
    }
  ],
  "directive_refs": [
    "VD-0001",
    "VD-0002",
    "VD-0011"
  ],
  "decision_rationale_refs": [
    "DR-0001",
    "DR-0002"
  ],
  "research_refs": [],
  "live_verify": [
    {
      "evidence_class": "LIVE_GITHUB",
      "target": "repository:1366835183/main=d5dd4c18917447c37590b125ce4c6d77f01e5e91",
      "required": true
    },
    {
      "evidence_class": "LIVE_GITHUB",
      "target": "work/4264779b-70c5-4381-b619-f2c3204dc4f3@2fd4f5127d2c70625a7c6a624594b2cf00224531",
      "required": true
    },
    {
      "evidence_class": "LIVE_GITHUB",
      "target": "GITHUB_PR:92",
      "required": true
    },
    {
      "evidence_class": "LIVE_GITHUB",
      "target": "lock/39f64bd9d0ea39ae54c0417742d6c38cf0eccf0fdb7b2a4b7867a7662ae48c33",
      "required": true
    },
    {
      "evidence_class": "LIVE_SUPABASE",
      "target": "jnenguxodtgwbskhdsxt",
      "required": true
    }
  ],
  "resume_candidate": {
    "operation_state": "PENDING",
    "candidate_next_operation": "READ_BACK_THIS_CHECKPOINT; UPDATE THE ISSUE #57 WORK RECORD TO INCLUDE THIS CHECKPOINT; RENEW THE CURRENT GENERATION-4 CLAIM; RERUN EXACT-HEAD CI; IF GREEN AND CURRENT MAIN/CLAIM REMAIN EXACT, ENQUEUE PR #92 IN THE REQUIRED GITHUB MERGE QUEUE; VERIFY MERGE_GROUP SUCCESS, MERGED-MAIN READBACK, POST-MERGE VALIDATION, AND THE SOURCE-ONLY RUNTIME-AUTHORITY BOUNDARY BEFORE ANY TERMINAL CLAIM.",
    "authority": "NONE"
  },
  "context_refs": [
    "GITHUB_ISSUE:57:Migrate legacy Semantic Firewall and make the work deterministically dispatchable",
    "GITHUB_PR:91:Repair post-merge v4 work-selection fixtures",
    "GITHUB_PR:92:Close predicate-level ambiguity in Semantic Firewall",
    "GITHUB_MAIN:d5dd4c18917447c37590b125ce4c6d77f01e5e91",
    "GITHUB_WORK_BRANCH:2fd4f5127d2c70625a7c6a624594b2cf00224531",
    "governance/goal-registry.json:2910e7b9-87d8-4a82-b0ff-330b47037bf6",
    "continuity/current.json:A-0014:Terminal Redispatch & Issue Lifecycle Closure",
    "contracts/semantic-firewall-v1/predicate-registry.json",
    "contracts/semantic-firewall-v1/predicate-registry.schema.json",
    "contracts/semantic-firewall-v1/control-contract.schema.json"
  ]
}
